{
 "$schema": "https://json-schema.org/draft/2020-12/schema",
 "title": "US cash bids full history",
 "type": "object",
 "required": [
  "schemaVersion",
  "generatedAt",
  "state",
  "commodity",
  "sourceId",
  "series"
 ],
 "properties": {
  "schemaVersion": {
   "type": [
    "integer",
    "string"
   ]
  },
  "generatedAt": {
   "type": "string",
   "pattern": "^\\d{4}-\\d{2}-\\d{2}T\\d{2}:\\d{2}"
  },
  "state": {
   "type": "string",
   "pattern": "^[A-Z]{2}$"
  },
  "commodity": {
   "type": "string"
  },
  "sourceId": {
   "type": "string"
  },
  "series": {
   "type": "object",
   "required": [],
   "properties": {},
   "minProperties": 1,
   "additionalSchema": {
    "type": "object",
    "required": [
     "pts",
     "reportId",
     "state",
     "commodity",
     "locationName",
     "locationType",
     "unit"
    ],
    "properties": {
     "reportId": {
      "type": "integer",
      "minimum": 0
     },
     "state": {
      "type": "string"
     },
     "commodity": {
      "type": "string",
      "minLength": 1
     },
     "commodityName": {
      "type": "string"
     },
     "commodityClass": {
      "type": [
       "string",
       "null"
      ]
     },
     "grade": {
      "type": [
       "string",
       "null"
      ]
     },
     "protein": {
      "type": [
       "string",
       "null"
      ]
     },
     "deliveryPoint": {
      "type": [
       "string",
       "null"
      ]
     },
     "locationName": {
      "type": [
       "string",
       "null"
      ]
     },
     "locationType": {
      "type": "string",
      "enum": [
       "ELEVATOR",
       "TERMINAL",
       "CITY",
       "REGION",
       "STATE",
       "EXPORT_MARKET",
       "UNKNOWN"
      ]
     },
     "freight": {
      "type": [
       "string",
       "null"
      ]
     },
     "saleType": {
      "type": [
       "string",
       "null"
      ]
     },
     "transMode": {
      "type": [
       "string",
       "null"
      ]
     },
     "description": {
      "type": [
       "string",
       "null"
      ]
     },
     "application": {
      "type": [
       "string",
       "null"
      ]
     },
     "deliveryPeriod": {
      "type": [
       "string",
       "null"
      ]
     },
     "currency": {
      "type": [
       "string",
       "null"
      ]
     },
     "unit": {
      "type": "string",
      "minLength": 1
     },
     "futuresContract": {
      "type": [
       "string",
       "null"
      ]
     },
     "basisUnit": {
      "type": [
       "string",
       "null"
      ]
     },
     "pts": {
      "type": "array",
      "minItems": 1,
      "items": {
       "type": "array",
       "minItems": 6,
       "maxItems": 7
      }
     }
    }
   }
  }
 }
}
