{"schemaVersion":1,"generatedAt":"2026-10-12T23:42:56Z","state":"OK","commodity":"sorghum","sourceId":"usda_ams_mars","series":{"us-cb:3100:24c72f7541":{"reportId":3100,"state":"OK","commodity":"sorghum","commodityName":"Sorghum","commodityClass":null,"grade":"US #1","protein":null,"deliveryPoint":"Country Elevators","locationName":"Northwest","locationType":"REGION","freight":null,"saleType":null,"transMode":null,"description":"New Crop","application":null,"deliveryPeriod":"2026-07-01/2026-07-01","currency":"USD","unit":"bu","pts":[["2026-06-01",3.69,3.69,3.69,null,null,null],["2026-06-02",3.655,3.655,3.655,null,null,null],["2026-06-03",3.565,3.565,3.565,null,null,null],["2026-06-04",3.495,3.495,3.495,null,null,null],["2026-06-05",3.425,3.425,3.425,null,null,null],["2026-06-08",3.4375,3.4375,3.4375,null,null,null],["2026-06-09",3.445,3.445,3.445,null,null,null],["2026-06-10",3.44,3.44,3.44,null,null,null],["2026-06-11",3.3675,3.3675,3.3675,null,null,null],["2026-06-12",3.3775,3.3775,3.3775,null,null,null],["2026-06-15",3.405,3.405,3.405,null,null,null],["2026-06-16",3.3875,3.3875,3.3875,null,null,null],["2026-06-17",3.46,3.46,3.46,null,null,null],["2026-06-18",3.425,3.425,3.425,null,null,null],["2026-06-22",3.365,3.365,3.365,null,null,null],["2026-06-23",3.3475,3.3475,3.3475,null,null,null],["2026-06-24",3.32,3.32,3.32,null,null,null],["2026-06-25",3.3975,3.3975,3.3975,null,null,null],["2026-06-26",3.3775,3.3775,3.3775,null,null,null],["2026-06-29",3.27,3.27,3.27,null,null,null],["2026-06-30",3.3775,3.3775,3.3775,null,null,null],["2026-07-01",3.4775,3.4775,3.4775,null,null,null],["2026-07-02",3.48,3.48,3.48,null,null,null]]},"us-cb:3100:6ef86b807b":{"reportId":3100,"state":"OK","commodity":"sorghum","commodityName":"Sorghum","commodityClass":null,"grade":"US #1","protein":null,"deliveryPoint":"Country Elevators","locationName":"Northwest","locationType":"REGION","freight":null,"saleType":null,"transMode":null,"description":"New Crop","application":null,"deliveryPeriod":"2026-09-01/2026-09-01","currency":"USD","unit":"bu","pts":[["2026-07-06",3.6325,3.6325,3.6325,null,null,null],["2026-07-07",3.6875,3.6875,3.6875,null,null,null],["2026-07-08",3.6,3.6,3.6,null,null,null],["2026-07-09",3.565,3.565,3.565,null,null,null],["2026-07-10",3.645,3.645,3.645,null,null,null],["2026-07-13",3.66,3.66,3.66,null,null,null],["2026-07-14",3.635,3.635,3.635,null,null,null],["2026-07-15",3.725,3.725,3.725,null,null,null],["2026-07-16",3.665,3.665,3.665,null,null,null],["2026-07-17",3.6975,3.6975,3.6975,null,null,null],["2026-07-20",3.745,3.745,3.745,null,null,null],["2026-07-21",3.7775,3.7775,3.7775,null,null,null],["2026-07-22",3.87,3.87,3.87,null,null,null],["2026-07-23",3.89,3.89,3.89,null,null,null],["2026-07-24",3.8925,3.8925,3.8925,null,null,null],["2026-07-27",3.7675,3.7675,3.7675,null,null,null],["2026-07-28",3.835,3.835,3.835,null,null,null],["2026-07-29",3.74,3.74,3.74,null,null,null],["2026-07-30",3.7075,3.7075,3.7075,null,null,null],["2026-07-31",3.8075,3.8075,3.8075,null,null,null]]},"us-cb:3100:aa3f1a6a79":{"reportId":3100,"state":"OK","commodity":"sorghum","commodityName":"Sorghum","commodityClass":null,"grade":"US #1","protein":null,"deliveryPoint":"Country Elevators","locationName":"Northwest","locationType":"REGION","freight":null,"saleType":null,"transMode":null,"description":"New Crop","application":null,"deliveryPeriod":"2026-10-01/2026-10-01","currency":"USD","unit":"bu","pts":[["2026-08-31",4.7775,4.7775,4.7775,null,null,null],["2026-09-01",4.86,4.86,4.86,null,null,null],["2026-09-02",4.835,4.835,4.835,null,null,null],["2026-09-03",4.8075,4.8075,4.8075,null,null,null],["2026-09-04",4.7675,4.7675,4.7675,null,null,null],["2026-09-08",4.735,4.735,4.735,null,null,null],["2026-09-09",4.6775,4.6775,4.6775,null,null,null],["2026-09-10",4.7375,4.7375,4.7375,-60.0,-60.0,"2026-09-10T14:15"],["2026-09-11",4.7025,4.7025,4.7025,-60.0,-60.0,"2026-09-11T14:23"],["2026-09-14",4.7325,4.7325,4.7325,-60.0,-60.0,"2026-09-14T14:31"],["2026-09-15",4.7575,4.7575,4.7575,-60.0,-60.0,"2026-09-15T13:15"],["2026-09-16",4.7425,4.7425,4.7425,-60.0,-60.0,"2026-09-16T14:11"],["2026-09-17",4.705,4.705,4.705,-60.0,-60.0,"2026-09-17T14:19"],["2026-09-18",4.675,4.675,4.675,-60.0,-60.0,"2026-09-18T14:34"],["2026-09-21",4.83,4.83,4.83,-60.0,-60.0,"2026-09-21T14:04"],["2026-09-22",4.7675,4.7675,4.7675,-60.0,-60.0,"2026-09-22T13:13"],["2026-09-23",4.69,4.69,4.69,-60.0,-60.0,"2026-09-23T14:25"],["2026-09-24",4.675,4.675,4.675,-60.0,-60.0,"2026-09-24T13:54"],["2026-09-25",4.6825,4.6825,4.6825,-60.0,-60.0,"2026-09-25T13:53"],["2026-09-28",4.63,4.63,4.63,-60.0,-60.0,"2026-09-28T14:53"],["2026-09-29",4.62,4.62,4.62,-60.0,-60.0,"2026-09-29T14:39"],["2026-09-30",4.4075,4.4075,4.4075,-60.0,-60.0,"2026-09-30T13:23"],["2026-10-01",4.4225,4.4225,4.4225,-60.0,-60.0,"2026-10-01T14:11"],["2026-10-02",4.3775,4.3775,4.3775,-60.0,-60.0,"2026-10-02T13:41"],["2026-10-05",4.3725,4.3725,4.3725,-60.0,-60.0,"2026-10-05T14:29"],["2026-10-06",4.48,4.48,4.48,-60.0,-60.0,"2026-10-06T14:21"],["2026-10-07",4.42,4.42,4.42,-60.0,-60.0,"2026-10-07T14:18"],["2026-10-08",4.4025,4.4025,4.4025,-60.0,-60.0,"2026-10-08T14:11"],["2026-10-09",4.1975,4.1975,4.1975,-60.0,-60.0,"2026-10-09T14:03"],["2026-10-12",4.23,4.23,4.23,-60.0,-60.0,"2026-10-12T14:09"]],"basisUnit":"¢/Bu","futuresContract":"December (Z)"},"us-cb:3100:bd43775177":{"reportId":3100,"state":"OK","commodity":"sorghum","commodityName":"Sorghum","commodityClass":null,"grade":"US #1","protein":null,"deliveryPoint":"Country Elevators","locationName":"West","locationType":"REGION","freight":null,"saleType":null,"transMode":null,"description":null,"application":null,"deliveryPeriod":null,"currency":"USD","unit":"bu","pts":[["2026-05-26",3.375,3.375,3.375,null,null,null],["2026-05-27",3.325,3.325,3.325,null,null,null],["2026-05-28",3.3575,3.3575,3.3575,null,null,null],["2026-05-29",3.2675,3.2675,3.2675,null,null,null],["2026-06-01",3.24,3.24,3.24,null,null,null],["2026-06-02",3.205,3.205,3.205,null,null,null],["2026-06-03",3.115,3.115,3.115,null,null,null],["2026-06-04",3.045,3.045,3.045,null,null,null],["2026-06-05",2.975,2.975,2.975,null,null,null],["2026-06-08",2.9875,2.9875,2.9875,null,null,null],["2026-06-09",2.995,2.995,2.995,null,null,null],["2026-06-10",2.99,2.99,2.99,null,null,null],["2026-06-11",2.9175,2.9175,2.9175,null,null,null],["2026-06-12",2.9275,2.9275,2.9275,null,null,null],["2026-06-15",2.955,2.955,2.955,null,null,null],["2026-06-16",2.9375,2.9375,2.9375,null,null,null],["2026-06-17",3.01,3.01,3.01,null,null,null],["2026-06-18",2.975,2.975,2.975,null,null,null],["2026-06-22",2.915,2.915,2.915,null,null,null],["2026-06-23",2.9975,2.9975,2.9975,null,null,null],["2026-06-24",2.97,2.97,2.97,null,null,null],["2026-06-25",3.0475,3.0475,3.0475,null,null,null],["2026-06-26",3.0775,3.0775,3.0775,null,null,null],["2026-06-29",2.97,2.97,2.97,null,null,null],["2026-06-30",3.0775,3.0775,3.0775,null,null,null],["2026-07-01",3.0775,3.0775,3.0775,null,null,null],["2026-07-02",3.08,3.08,3.08,null,null,null],["2026-07-06",3.2325,3.2325,3.2325,null,null,null],["2026-07-07",3.2875,3.2875,3.2875,null,null,null],["2026-07-08",3.2,3.2,3.2,null,null,null],["2026-07-09",3.165,3.165,3.165,null,null,null],["2026-07-10",3.245,3.245,3.245,null,null,null],["2026-07-13",3.26,3.26,3.26,null,null,null],["2026-07-14",3.235,3.235,3.235,null,null,null],["2026-07-15",3.325,3.325,3.325,null,null,null],["2026-07-16",3.265,3.265,3.265,null,null,null],["2026-07-17",3.2975,3.2975,3.2975,null,null,null],["2026-07-20",3.345,3.345,3.345,null,null,null],["2026-07-21",3.3775,3.3775,3.3775,null,null,null],["2026-07-22",3.67,3.67,3.67,null,null,null],["2026-07-23",3.69,3.69,3.69,null,null,null],["2026-07-24",3.7425,3.7425,3.7425,null,null,null],["2026-07-27",3.6175,3.6175,3.6175,null,null,null],["2026-07-28",3.685,3.685,3.685,null,null,null],["2026-07-29",3.59,3.59,3.59,null,null,null],["2026-07-30",3.5575,3.5575,3.5575,null,null,null],["2026-07-31",3.5575,3.5575,3.5575,null,null,null],["2026-08-03",3.6425,3.6425,3.6425,null,null,null],["2026-08-04",3.5725,3.5725,3.5725,null,null,null],["2026-08-05",3.75,3.75,3.75,null,null,null],["2026-08-06",3.77,3.77,3.77,null,null,null],["2026-08-07",3.77,3.77,3.77,null,null,null],["2026-08-10",3.7675,3.7675,3.7675,null,null,null],["2026-08-11",3.755,3.755,3.755,null,null,null],["2026-08-12",3.9575,3.9575,3.9575,null,null,null],["2026-08-13",3.87,3.87,3.87,null,null,null],["2026-08-14",3.9825,3.9825,3.9825,null,null,null],["2026-08-17",4.045,4.045,4.045,null,null,null],["2026-08-18",4.03,4.03,4.03,null,null,null],["2026-08-19",4.13,4.13,4.13,null,null,null],["2026-08-20",4.185,4.185,4.185,null,null,null],["2026-08-21",4.235,4.235,4.235,null,null,null],["2026-08-24",4.305,4.305,4.305,null,null,null],["2026-08-25",4.385,4.385,4.385,null,null,null],["2026-08-26",4.515,4.515,4.515,null,null,null],["2026-08-27",4.485,4.485,4.485,null,null,null],["2026-08-28",4.515,4.515,4.515,null,null,null],["2026-08-31",4.5275,4.5275,4.5275,null,null,null],["2026-09-01",4.61,4.61,4.61,null,null,null],["2026-09-02",4.585,4.585,4.585,null,null,null],["2026-09-03",4.5575,4.5575,4.5575,null,null,null],["2026-09-04",4.5175,4.5175,4.5175,null,null,null],["2026-09-08",4.485,4.485,4.485,null,null,null],["2026-09-09",4.4275,4.4275,4.4275,null,null,null],["2026-09-10",4.4875,4.4875,4.4875,-85.0,-85.0,"2026-09-10T14:15"],["2026-09-11",4.4525,4.4525,4.4525,-85.0,-85.0,"2026-09-11T14:23"],["2026-09-14",4.4825,4.4825,4.4825,-85.0,-85.0,"2026-09-14T14:31"],["2026-09-15",4.5075,4.5075,4.5075,-85.0,-85.0,"2026-09-15T13:15"],["2026-09-16",4.4925,4.4925,4.4925,-85.0,-85.0,"2026-09-16T14:11"],["2026-09-17",4.455,4.455,4.455,-85.0,-85.0,"2026-09-17T14:19"],["2026-09-18",4.425,4.425,4.425,-85.0,-85.0,"2026-09-18T14:34"],["2026-09-21",4.58,4.58,4.58,-85.0,-85.0,"2026-09-21T14:04"],["2026-09-22",4.5175,4.5175,4.5175,-85.0,-85.0,"2026-09-22T13:13"],["2026-09-23",4.44,4.44,4.44,-85.0,-85.0,"2026-09-23T14:25"],["2026-09-24",4.425,4.425,4.425,-85.0,-85.0,"2026-09-24